<?xml version="1.0" encoding="utf-8"?>

<OptionalElements:document xmlns:xsi="http://www.w3.org/2001/XMLSchema-instance" xsi:schemaLocation="OptionalElements optional_elements.xsd" xmlns:OptionalElements="OptionalElements">
    <TestElement1>
        <Element_double>100.22</Element_double>
    </TestElement1>

    <TestElement2>
        <Element_string></Element_string>
        <Element_double></Element_double>
    </TestElement2>

    <TestElement3></TestElement3>

    <TestElement4>
        
    </TestElement4>
    <TestElement5></TestElement5>

    <TestElement6>
        <Element_simple3></Element_simple3>
    </TestElement6>
</OptionalElements:document>